{
  "$schema": "http://json-schema.org/draft-07/schema#",
  "$id": "https://codyswann.github.io/lisa/schema/lisa-wiki-config.schema.json",
  "title": "lisa-wiki project config",
  "description": "Per-project behavioral config for the lisa-wiki plugin. Lives at wiki/lisa-wiki.config.json. The plugin's validate-config script enforces these constraints dependency-free; this schema is the authoritative spec and powers editor tooling.",
  "type": "object",
  "additionalProperties": true,
  "required": ["schemaVersion", "org", "mode", "wikiRoot", "categories"],
  "properties": {
    "schemaVersion": { "type": "string", "description": "Config schema version (semver)." },
    "org": { "type": "string", "description": "Owning organization / project name." },
    "displayName": { "type": "string", "description": "Human-facing wiki name." },
    "purpose": { "type": "string", "description": "One paragraph: what this wiki is for. Asked by /setup; rendered into the contract + start-here; feeds /onboard-me." },
    "mode": { "enum": ["embedded", "wrapper", "standalone", "subdir"], "description": "Repository model." },
    "wikiRoot": { "type": "string", "default": "wiki", "description": "Path to the wiki root, relative to repo root." },
    "frontmatter": { "type": "boolean", "default": true, "description": "Whether new/touched pages require YAML frontmatter." },
    "categories": { "type": "array", "items": { "type": "string" }, "minItems": 1, "description": "Synthesis category directories." },
    "sources": {
      "type": "object",
      "additionalProperties": true,
      "properties": {
        "layout": { "enum": ["by-system", "by-category"], "default": "by-system" },
        "buckets": { "type": "array", "items": { "type": "string" } }
      }
    },
    "git": {
      "type": "object",
      "additionalProperties": true,
      "properties": {
        "prPerIngestion": { "type": "boolean" },
        "autoMerge": { "type": "boolean" },
        "targetBranch": { "type": "string" },
        "branchPrefix": { "type": "string" }
      }
    },
    "sensitivity": {
      "type": "object",
      "additionalProperties": false,
      "properties": {
        "enabled": { "type": "boolean" },
        "default": { "enum": ["public", "internal", "confidential", "restricted"] },
        "redaction": {
          "type": "object",
          "additionalProperties": false,
          "properties": {
            "enabled": { "type": "boolean" },
            "scanners": {
              "type": "array",
              "items": { "enum": ["builtin", "gitleaks", "presidio"] },
              "minItems": 1
            },
            "failClosed": { "type": "boolean" },
            "requireReview": { "type": "boolean" },
            "allowedEntities": {
              "type": "array",
              "items": {
                "enum": [
                  "api_key",
                  "bank_account",
                  "credit_card",
                  "oauth_token",
                  "password",
                  "private_key",
                  "routing_number",
                  "ssn"
                ]
              }
            },
            "blockedEntities": {
              "type": "array",
              "items": {
                "enum": [
                  "api_key",
                  "bank_account",
                  "credit_card",
                  "oauth_token",
                  "password",
                  "private_key",
                  "routing_number",
                  "ssn"
                ]
              }
            }
          }
        }
      }
    },
    "sourceRetention": { "enum": ["raw-ok", "sanitized-note-only", "metadata-only", "external-pointer-only"] },
    "readme": {
      "type": "object",
      "additionalProperties": false,
      "properties": { "mode": { "enum": ["rich", "stub", "preserve"], "default": "rich" } }
    },
    "documentation": {
      "type": "object",
      "additionalProperties": true,
      "properties": {
        "absorb": { "type": "boolean", "default": true },
        "keepInPlace": { "type": "array", "items": { "type": "string" } }
      }
    },
    "onboarding": {
      "type": "object",
      "additionalProperties": true,
      "properties": { "allowAudienceNote": { "type": "boolean", "default": false } }
    },
    "connectors": {
      "type": "object",
      "description": "Map of connector name -> connector config.",
      "additionalProperties": {
        "type": "object",
        "additionalProperties": true,
        "required": ["sideEffects"],
        "properties": {
          "enabled": { "type": "boolean" },
          "sideEffects": { "enum": ["read-only-ingest", "repo-write", "external-write"] }
        }
      }
    },
    "customConnectors": {
      "type": "array",
      "description": "Explicit allowlist of project-authored front-door ingest skills (generated by /add-ingest). No auto-discovery.",
      "items": {
        "type": "object",
        "additionalProperties": true,
        "required": ["name", "skill", "sourceSystem", "sideEffects"],
        "properties": {
          "name": { "type": "string" },
          "skill": { "type": "string" },
          "sourceSystem": { "type": "string" },
          "stateFile": { "type": "string" },
          "sideEffects": { "enum": ["read-only-ingest", "repo-write", "external-write"] }
        }
      }
    },
    "staff": {
      "type": "array",
      "description": "Digital-staff roles. Each generates a wiki/staff/<id>.md doc page + dual-runtime subagents.",
      "items": {
        "type": "object",
        "additionalProperties": true,
        "required": ["id", "role"],
        "properties": {
          "id": { "type": "string" },
          "role": { "type": "string" },
          "expertise": { "type": "string" },
          "owns": {
            "type": "object",
            "additionalProperties": true,
            "properties": {
              "categories": { "type": "array", "items": { "type": "string" } },
              "connectors": { "type": "array", "items": { "type": "string" } },
              "skills": { "type": "array", "items": { "type": "string" } }
            }
          },
          "sensitivity": { "enum": ["public", "internal", "confidential", "restricted"] }
        }
      }
    },
    "contaminationTerms": { "type": "array", "items": { "type": "string" }, "description": "Cross-tenant terms scanned for before every commit." }
  }
}
